{
  "format": "toads-raid-loot",
  "version": 1,
  "source": {
    "package": "wow-classic-items@2.0.1",
    "note": "Built by tools/build_loot.py from the wow-classic-items scrape of Wowhead plus data/loot/overrides.json."
  },
  "zones": [
    {
      "name": "Karazhan",
      "phase": 1,
      "bosses": [
        "Servant's Quarters",
        "Attumen the Huntsman",
        "Moroes",
        "Maiden of Virtue",
        "Opera Hall",
        "The Curator",
        "Terestian Illhoof",
        "Shade of Aran",
        "Netherspite",
        "Chess Event",
        "Prince Malchezaar",
        "Nightbane"
      ]
    },
    {
      "name": "Gruul's Lair",
      "phase": 1,
      "bosses": [
        "High King Maulgar",
        "Gruul the Dragonkiller"
      ]
    },
    {
      "name": "Magtheridon's Lair",
      "phase": 1,
      "bosses": [
        "Magtheridon"
      ]
    },
    {
      "name": "Serpentshrine Cavern",
      "phase": 2,
      "bosses": [
        "Hydross the Unstable",
        "The Lurker Below",
        "Leotheras the Blind",
        "Fathom-Lord Karathress",
        "Morogrim Tidewalker",
        "Lady Vashj"
      ]
    },
    {
      "name": "Tempest Keep",
      "phase": 2,
      "bosses": [
        "Al'ar",
        "Void Reaver",
        "High Astromancer Solarian",
        "Kael'thas Sunstrider"
      ]
    },
    {
      "name": "Hyjal Summit",
      "phase": 3,
      "bosses": [
        "Rage Winterchill",
        "Anetheron",
        "Kaz'rogal",
        "Azgalor",
        "Archimonde"
      ]
    },
    {
      "name": "Black Temple",
      "phase": 3,
      "bosses": [
        "High Warlord Naj'entus",
        "Supremus",
        "Shade of Akama",
        "Teron Gorefiend",
        "Gurtogg Bloodboil",
        "Reliquary of Souls",
        "Mother Shahraz",
        "The Illidari Council",
        "Illidan Stormrage"
      ]
    },
    {
      "name": "Zul'Aman",
      "phase": 4,
      "bosses": [
        "Nalorakk",
        "Akil'zon",
        "Jan'alai",
        "Halazzi",
        "Hex Lord Malacrass",
        "Zul'jin"
      ]
    },
    {
      "name": "Sunwell Plateau",
      "phase": 5,
      "bosses": [
        "Kalecgos",
        "Brutallus",
        "Felmyst",
        "Eredar Twins",
        "M'uru",
        "Kil'jaeden"
      ]
    }
  ],
  "items": [
    {"itemId": 30675, "name": "Lurker's Cord", "quality": "Epic", "slot": "Waist", "itemLevel": 115, "zone": "Karazhan", "boss": "Servant's Quarters", "phase": 1},
    {"itemId": 30676, "name": "Lurker's Grasp", "quality": "Epic", "slot": "Waist", "itemLevel": 115, "zone": "Karazhan", "boss": "Servant's Quarters", "phase": 1},
    {"itemId": 30677, "name": "Lurker's Belt", "quality": "Epic", "slot": "Waist", "itemLevel": 115, "zone": "Karazhan", "boss": "Servant's Quarters", "phase": 1},
    {"itemId": 30678, "name": "Lurker's Girdle", "quality": "Epic", "slot": "Waist", "itemLevel": 115, "zone": "Karazhan", "boss": "Servant's Quarters", "phase": 1},
    {"itemId": 30680, "name": "Glider's Foot-Wraps", "quality": "Epic", "slot": "Feet", "itemLevel": 115, "zone": "Karazhan", "boss": "Servant's Quarters", "phase": 1},
    {"itemId": 30681, "name": "Glider's Boots", "quality": "Epic", "slot": "Feet", "itemLevel": 115, "zone": "Karazhan", "boss": "Servant's Quarters", "phase": 1},
    {"itemId": 30682, "name": "Glider's Sabatons", "quality": "Epic", "slot": "Feet", "itemLevel": 115, "zone": "Karazhan", "boss": "Servant's Quarters", "phase": 1},
    {"itemId": 30683, "name": "Glider's Greaves", "quality": "Epic", "slot": "Feet", "itemLevel": 115, "zone": "Karazhan", "boss": "Servant's Quarters", "phase": 1},
    {"itemId": 30684, "name": "Ravager's Cuffs", "quality": "Epic", "slot": "Wrist", "itemLevel": 115, "zone": "Karazhan", "boss": "Servant's Quarters", "phase": 1},
    {"itemId": 30685, "name": "Ravager's Wrist-Wraps", "quality": "Epic", "slot": "Wrist", "itemLevel": 115, "zone": "Karazhan", "boss": "Servant's Quarters", "phase": 1},
    {"itemId": 30686, "name": "Ravager's Bands", "quality": "Epic", "slot": "Wrist", "itemLevel": 115, "zone": "Karazhan", "boss": "Servant's Quarters", "phase": 1},
    {"itemId": 30687, "name": "Ravager's Bracers", "quality": "Epic", "slot": "Wrist", "itemLevel": 115, "zone": "Karazhan", "boss": "Servant's Quarters", "phase": 1},
    {"itemId": 28453, "name": "Bracers of the White Stag", "quality": "Epic", "slot": "Wrist", "itemLevel": 115, "zone": "Karazhan", "boss": "Attumen the Huntsman", "phase": 1},
    {"itemId": 28454, "name": "Stalker's War Bands", "quality": "Epic", "slot": "Wrist", "itemLevel": 115, "zone": "Karazhan", "boss": "Attumen the Huntsman", "phase": 1},
    {"itemId": 28477, "name": "Harbinger Bands", "quality": "Epic", "slot": "Wrist", "itemLevel": 115, "zone": "Karazhan", "boss": "Attumen the Huntsman", "phase": 1},
    {"itemId": 28502, "name": "Vambraces of Courage", "quality": "Epic", "slot": "Wrist", "itemLevel": 115, "zone": "Karazhan", "boss": "Attumen the Huntsman", "phase": 1},
    {"itemId": 28503, "name": "Whirlwind Bracers", "quality": "Epic", "slot": "Wrist", "itemLevel": 115, "zone": "Karazhan", "boss": "Attumen the Huntsman", "phase": 1},
    {"itemId": 28504, "name": "Steelhawk Crossbow", "quality": "Epic", "slot": "Ranged", "itemLevel": 115, "zone": "Karazhan", "boss": "Attumen the Huntsman", "phase": 1},
    {"itemId": 28505, "name": "Gauntlets of Renewed Hope", "quality": "Epic", "slot": "Hands", "itemLevel": 115, "zone": "Karazhan", "boss": "Attumen the Huntsman", "phase": 1},
    {"itemId": 28506, "name": "Gloves of Dexterous Manipulation", "quality": "Epic", "slot": "Hands", "itemLevel": 115, "zone": "Karazhan", "boss": "Attumen the Huntsman", "phase": 1},
    {"itemId": 28507, "name": "Handwraps of Flowing Thought", "quality": "Epic", "slot": "Hands", "itemLevel": 115, "zone": "Karazhan", "boss": "Attumen the Huntsman", "phase": 1},
    {"itemId": 28508, "name": "Gloves of Saintly Blessings", "quality": "Epic", "slot": "Hands", "itemLevel": 115, "zone": "Karazhan", "boss": "Attumen the Huntsman", "phase": 1},
    {"itemId": 28509, "name": "Worgen Claw Necklace", "quality": "Epic", "slot": "Neck", "itemLevel": 115, "zone": "Karazhan", "boss": "Attumen the Huntsman", "phase": 1},
    {"itemId": 28510, "name": "Spectral Band of Innervation", "quality": "Epic", "slot": "Finger", "itemLevel": 115, "zone": "Karazhan", "boss": "Attumen the Huntsman", "phase": 1},
    {"itemId": 30480, "name": "Fiery Warhorse's Reins", "quality": "Epic", "slot": "Non-equippable", "itemLevel": 40, "zone": "Karazhan", "boss": "Attumen the Huntsman", "phase": 1},
    {"itemId": 22559, "name": "Formula: Enchant Weapon - Mongoose", "quality": "Rare", "slot": "Non-equippable", "itemLevel": 75, "zone": "Karazhan", "boss": "Moroes", "phase": 1},
    {"itemId": 28524, "name": "Emerald Ripper", "quality": "Epic", "slot": "One-Hand", "itemLevel": 115, "zone": "Karazhan", "boss": "Moroes", "phase": 1},
    {"itemId": 28525, "name": "Signet of Unshakable Faith", "quality": "Epic", "slot": "Held In Off-hand", "itemLevel": 115, "zone": "Karazhan", "boss": "Moroes", "phase": 1},
    {"itemId": 28528, "name": "Moroes' Lucky Pocket Watch", "quality": "Epic", "slot": "Trinket", "itemLevel": 115, "zone": "Karazhan", "boss": "Moroes", "phase": 1},
    {"itemId": 28529, "name": "Royal Cloak of Arathi Kings", "quality": "Epic", "slot": "Back", "itemLevel": 115, "zone": "Karazhan", "boss": "Moroes", "phase": 1},
    {"itemId": 28530, "name": "Brooch of Unquenchable Fury", "quality": "Epic", "slot": "Neck", "itemLevel": 115, "zone": "Karazhan", "boss": "Moroes", "phase": 1},
    {"itemId": 28545, "name": "Edgewalker Longboots", "quality": "Epic", "slot": "Feet", "itemLevel": 115, "zone": "Karazhan", "boss": "Moroes", "phase": 1},
    {"itemId": 28565, "name": "Nethershard Girdle", "quality": "Epic", "slot": "Waist", "itemLevel": 115, "zone": "Karazhan", "boss": "Moroes", "phase": 1},
    {"itemId": 28566, "name": "Crimson Girdle of the Indomitable", "quality": "Epic", "slot": "Waist", "itemLevel": 115, "zone": "Karazhan", "boss": "Moroes", "phase": 1},
    {"itemId": 28567, "name": "Belt of Gale Force", "quality": "Epic", "slot": "Waist", "itemLevel": 115, "zone": "Karazhan", "boss": "Moroes", "phase": 1},
    {"itemId": 28568, "name": "Idol of the Avian Heart", "quality": "Epic", "slot": "Relic", "itemLevel": 115, "zone": "Karazhan", "boss": "Moroes", "phase": 1},
    {"itemId": 28569, "name": "Boots of Valiance", "quality": "Epic", "slot": "Feet", "itemLevel": 115, "zone": "Karazhan", "boss": "Moroes", "phase": 1},
    {"itemId": 28570, "name": "Shadow-Cloak of Dalaran", "quality": "Epic", "slot": "Back", "itemLevel": 115, "zone": "Karazhan", "boss": "Moroes", "phase": 1},
    {"itemId": 28511, "name": "Bands of Indwelling", "quality": "Epic", "slot": "Wrist", "itemLevel": 115, "zone": "Karazhan", "boss": "Maiden of Virtue", "phase": 1},
    {"itemId": 28512, "name": "Bracers of Justice", "quality": "Epic", "slot": "Wrist", "itemLevel": 115, "zone": "Karazhan", "boss": "Maiden of Virtue", "phase": 1},
    {"itemId": 28514, "name": "Bracers of Maliciousness", "quality": "Epic", "slot": "Wrist", "itemLevel": 115, "zone": "Karazhan", "boss": "Maiden of Virtue", "phase": 1},
    {"itemId": 28515, "name": "Bands of Nefarious Deeds", "quality": "Epic", "slot": "Wrist", "itemLevel": 115, "zone": "Karazhan", "boss": "Maiden of Virtue", "phase": 1},
    {"itemId": 28516, "name": "Barbed Choker of Discipline", "quality": "Epic", "slot": "Neck", "itemLevel": 115, "zone": "Karazhan", "boss": "Maiden of Virtue", "phase": 1},
    {"itemId": 28517, "name": "Boots of Foretelling", "quality": "Epic", "slot": "Feet", "itemLevel": 115, "zone": "Karazhan", "boss": "Maiden of Virtue", "phase": 1},
    {"itemId": 28518, "name": "Iron Gauntlets of the Maiden", "quality": "Epic", "slot": "Hands", "itemLevel": 115, "zone": "Karazhan", "boss": "Maiden of Virtue", "phase": 1},